{
    "reportId": "be4f9806-0b5f-45c3-a008-96fd2750f8cb",
    "serverIdentity": "https://test.governikus-eid.de/gov_autent/async",
    "reportTime": "2020-06-25T10:20:39Z",
    "identificationTime": "2020-06-25T10:19:54Z",
    "subjectRef": {
        "givenName": "Max",
        "familyName": "Mustermann"
    },
    "idStatement": "successful identification sent by SAML-Assertion",
    "levelOfAssurance": "http://eidas.europa.eu/LoA/high"
}
